### ISSUE TITLE
Seemingly deaf interface increases received and transmitted packages

### ISSUE THREAD

**Issue by ilario** [nicopace/cotonete#4]
I am using an Ubiquiti NanoStation M2 as client, and at a certain point it couldn't ping the gateway anymore.
I suspect the interface went deaf, _but I could be wrong, it could have been an AP problem_.
Cotonete did not detect it, as the numbers of sent and received packets are increasing anyway.
Could it be?

This is what tcpdump shows during this "deaf" time.

```
listening on wlan0-sta, link-type EN10MB (Ethernet), capture size 262144 bytes
12:37:39.279228 IP 192.168.1.63.35248 > 141.1.1.1.53: 42206+ A? www.google.com. (32)
12:37:39.279490 IP 192.168.1.63.35248 > 4.2.2.2.53: 42206+ A? www.google.com. (32)
12:37:39.280239 IP 192.168.1.63.3465 > 141.1.1.1.53: 37905+ AAAA? www.google.com. (32)
12:37:39.282145 IP 192.168.1.63.3465 > 4.2.2.2.53: 37905+ AAAA? www.google.com. (32)
12:37:45.463845 IP 192.168.1.63.56789 > 141.1.1.1.53: 21812+ PTR? 2.2.2.4.in-addr.arpa. (38)
12:37:50.473902 ARP, Request who-has 192.168.1.1 tell 192.168.1.63, length 28
12:37:51.322103 IP6 fe80::de9f:dbff:fe36:28a9 > ff02::1:ff20:8fa6: ICMP6, neighbor solicitation, who has fe80::de53:7cff:fe20:8fa6, length 32
12:37:51.482048 ARP, Request who-has 192.168.1.1 tell 192.168.1.63, length 28
12:37:55.482921 IP 192.168.1.63.40678 > 141.1.1.1.53: 40743+ PTR? 2.179.154.195.in-addr.arpa. (44)
12:38:00.556091 IP 192.168.1.63.28002 > 141.1.1.1.53: 58117+ PTR? 44.165.216.115.in-addr.arpa. (45)
12:38:05.562097 ARP, Request who-has 192.168.1.1 tell 192.168.1.63, length 28
12:38:05.643249 IP 192.168.1.63.49124 > 185.60.216.11.443: Flags [S], seq 3330035749, win 65535, options [mss 1460,sackOK,TS val 57158362 ecr 0,nop,wscale 5], length 0
```

Do you think that these packets would sum up to the transmitted packets number even if the interface is deaf (or in my case it was just an AP problem?)?
I will report here if the situation repeats, thanks.

**Comment by ilario** [comment]
Ok, I would say it was a deaf interface: it just happened again and rebooting fixed.
Next time it happens I will try @spiccinini's wifi-unstuck-wa

**Comment by ilario** [comment]
In the reported tcpdump did not appear, but also UDP packets being sent were visible.

@nicopace do you think that this makes sense? That a deaf interface can have the "packets sent" and "packets received" counter increasing?
Do you think we should include [wifi-unstuck-wa](https://github.com/libremesh/lime-packages/tree/master/packages/wifi-unstuck-wa) in the dependencies and use it as a fix?
